link,reference_no,directorate,no_of_posts,package,enquiries,requirements,duties,notes,employer,location,closing_date,criteria_question,please_note
https://jobs.gauteng.gov.za/Public/ViewJob.aspx?u=dhnOO+xQuX7fYbfPeGe+Pg==,refs/019535,PAEDIATRICS,1,Grade 1: R 1 214 805 - R 1 288 095 per annum (All-inclusive package) Grade 2: R 1 386 069 – R 1 469 883 per annum (All-inclusive package) Grade 3: R 1 605 330 – R 2 001 927 per annum (All-inclusive package),Prof. A Coovadia Tel No: (011) 470 9284 Ashraf.Coovadia@wits.ac.za,"Grade I: Appropriate qualification that allows for registration with HPCSA as a Medical Specialist in Paediatrics. Registration with the HPCSA as Medical Specialist in Paediatrics. Proof of current registration with HPCSA. A sub-specialty Paediatric in Paediatric Cardiology will be an advantage. Experience in undergraduate teaching and research will be an added advantage. 


Grade II: Appropriate qualification that allows for registration with HPCSA as a Medical Specialist in Paediatrics. Registration with the HPCSA as Medical Specialist in Paediatrics. Proof of current registration with HPCSA. A sub-specialty Paediatric in Paediatric Cardiology will be an advantage. At least 5 years of experience required after registration with the HPCSA as a Paediatrician. Experience in undergraduate teaching and research will be an added advantage. 


Grade III: Appropriate qualification that allows for registration with HPCSA as a Medical Specialist in Paediatrics. Registration with the HPCSA as Medical Specialist in Paediatrics. Proof of current registration with HPCSA. A sub-specialty Paediatric in Paediatric Cardiology will be an advantage. At least 10 years of experience required after registration with the HPCSA as a Paediatrician. Experience in undergraduate teaching and research will be an added advantage.","The successful candidate will provide clinical services in the following clinics apart from being part of the general paediatric ward units: Paediatric cardiology clinic and attend cardiac catheterizations other relevant meetings pertaining to paediatric cardiac cases. There will be additional clinical responsibilities in the functioning of the department such as, working in the POPD, as well as covering the neonatal ICU and nursery when on call. The candidate will be responsible for teaching and training of under and post graduate students, including supervision of medical interns, medical officers, registrars and fellows.","APPLICATIONS : Applications must be submitted on a duly completed new Z83 form. Candidates who apply online (http://professionaljobcentre.gpg.gov.za) must also attach a new Z83 form. Alternatively, candidates can apply by completing the online form on this link – Paediatric Specialist Post RMMCH 2023/24. The new Z83 must be fully completed (please refer to the left side of the Z83 special notes for clarity), it must be initialled and signed. Applicants are not required to submit copies of qualifications and other relevant documents on application but must submit a fully completed Z83 form and a detailed CV. The information on the new Z83 must be the same with that of the CV. Only shortlisted candidates will be required/requested to submit certified copies of qualifications and other relevant documents on or before the day of the interview following communication from HR. Failure to submit any of the requested documents will result in the application not being considered. Hardcopy applications must be forwarded to Rahima Moosa Mother and Child Hospital, Admin Building, Cnr. Fuel and Oudtshoorn Street, Coronationville or be posted to Private Bag X20, Newclare 2112. The Provincial Government of Gauteng is committed to the achievement and maintenance of diversity in employment, especially of race, gender, and disability. It is a legislative requirement that all newly appointed staff members be subjected to Personnel Suitability Checks (PSC) – verification, upon appointment within the Department. This verification process entails reference checks, identity verification, qualifications verification, criminal record checks as well as a credit/financial stability check. Successful candidates will be subjected to OHS medical surveillance as required by HBA regulations within the OHS Act 85 of 1993. Correspondence will be limited to shortlisted candidates only.",Department of Health,RAHIMA MOOSA MOTHER AND CHILD HOSPITAL,15-01-2024,"['Do you have an appropriate qualification that allows for registration with HPCSA as a Medical Specialist in Paediatrics?', 'Are you registered with the HPCSA as Medical Specialist in Paediatrics?', 'Do you have proof of current registration with HPCSA?']","Due to the large number of applications we envisage receiving, applications will not be acknowledged. If you 
                                                    do not receive any response within 3 months, please accept that your application was not successful."
https://jobs.gauteng.gov.za/Public/ViewJob.aspx?u=dhnOO+xQuX7pRDdJXH3HVw==,refs/019551,HUMAN RESOURCES MANAGEMENT,1,R294 321.00 per annum plus benefits,Mr. M Radebe: (012) 354 1661,"Senior Certificate (Grade 12): Degree/ National Diploma in Human Resource / Labour Relations. 2-3 years’ experience in Labour Relations. Valid driver’s license. Computer literacy. Knowledge, Skills, Training and Competence required: Knowledge of policies, regulations, acts practices and key legislative prescripts related to Labour Relations. Conflict resolution skills, Good communication, interpersonal written and verbal skills.","Deals with grievances, discipline, and abscondment cases in terms of laid down policies and procedures, represents the employer at Conciliation and Arbitration proceedings, Manage the functioning of staff relations in order to ensure the provision of high quality services. Participate in the development of staff relations matters. Identify training gaps and ensures the implementation of in-service training programmes. Investigate and preside over enquiries.","Applications should be submitted strictly online at the following E-Recruitment portal: http://professionaljobcenter.gpg.gov.za. No hand-delivered, faxed or emailed applications will be accepted. NB: For assistance with online applications please email your query to e-recruitment@gauteng.gov.za. Application should be accompanied by a fully completed and signed new Z83 application form obtainable from any Public Service Department or on the internet at www.dpsa.gov.za/documents plus a recently updated comprehensive Curriculum Vitae (CV). Applications without proof of a new Z83 application form and detailed CV will be disqualified. Applicants must indicate the post reference number on their applications. (Shortlisted candidates will receive communication from HR to submit certified copies of educational qualifications and other relevant documents not older than 6 months on or before the day of the interview). It is the applicant’s responsibility to have foreign qualifications evaluated by the South African Qualifications Authority (SAQA). All foreign qualification must be accompanied by evaluation certificate from the South African Qualification Authority (SAQA). Correspondence will only be limited to shortlisted candidates. Suitable candidates will be subjected to vetting and personnel pre-employment suitability checks (criminal record, citizenship, credit record checks, qualification verification and employment verification). Where applicable, candidates will be subjected to a skills/knowledge test. Medical Surveillance will be conducted on the recommended candidates. It is Department’s intention to promote representivity (race, gender, and disability) in the Public Service through the filling of these posts. The Department reserves the right not to appoint/fill this post. NB: The Public Service does not charge any fees for applying for posts. Should you be asked for a fee, please let the authorities know. PEOPLE WITH DISABILITY ARE ENCOURAGED TO APPLY.",Department of Health,STEVE BIKO ACADEMIC HOSPITAL,15-01-2024,"['Do you have Grade 12?', 'Do you have a Degree/National Diploma in Human Resources/Labour Relations?', 'Do you have a valid Drivers license?', 'Do you have 2-3 years experience in Labour Relations?']","Due to the large number of applications we envisage receiving, applications will not be acknowledged. If you 
                                                    do not receive any response within 3 months, please accept that your application was not successful."
https://jobs.gauteng.gov.za/Public/ViewJob.aspx?u=dhnOO+xQuX6BNrtMw3zOgQ==,refs/019553,HUMAN RESOURCES MANAGEMENT,1,R294 321.00 per annum plus benefits,Mr. M Radebe: (012) 354 1661,"An Appropriate NQF level 6 in Human Resource with 3-5 years’ relevant experience in the field. A demonstrated ability to provide leadership on HR practices and Administration. The ability to develop, monitor and evaluate Skills development legislation, HR policies and procedures. The ability to interpret and analyze HR data. Experience in developing reports and presenting them to management. Demonstrate experience in managing PERSAL and drawing reports. Ability to manage staff, work independently, adhere to strict deadlines. Knowledge of PERSAL systems. Knowledge of the Public Service Act, the Public Finance Management Act, Treasury Regulation, Resolution of PSCBC, PILIR, Performance Management and Development processes, Public Service Regulations, Labour Relations Act, Employment Equity Act and other HR legislation and prescript. Competences required: problem solving and analysis, people management. Good communication skills (verbal and non-verbal), report writing skills, negotiation, teambuilding, problem solving, conflict resolution and ability to work under pressure. Excellent ethics demeanor. Knowledge of employee relations and experience of National Core Standards will be an added advantage. Computer literacy is essentials. A valid driver’s license.","Monitor and coordinate Recruitment and Selection processes including procedure on recruiting foreigners. Implement and execute effective Human Resource functions. Manage and update staff establishment, databases to assist the HRIM section. Formulate advertisements internally and externally. Coordinate and manage employment equity, render an effective HR advisory service to management and employees. Provide training and support to subordinates. Manage and support performance of subordinates. Allocate and control delegated work, provide monthly statistics and reports. Control and provide administrative service and ensure compliance with applicable legislation. Implement National Core Standards file and update it regularly. Implement and monitor Personnel and salary policies and procedures. Implementation and monitor appointments; transfers; translations; overtime (normal and commuted) ; allowances GEHS; Terminations i.e Pensions ; OSD implementation.","Applications should be submitted strictly online at the following E-Recruitment portal: http://professionaljobcenter.gpg.gov.za. No hand-delivered, faxed or emailed applications will be accepted. NB: For assistance with online applications please email your query to e-recruitment@gauteng.gov.za. Application should be accompanied by a fully completed and signed new Z83 application form obtainable from any Public Service Department or on the internet at www.dpsa.gov.za/documents plus a recently updated comprehensive Curriculum Vitae (CV). Applications without proof of a new Z83 application form and detailed CV will be disqualified. Applicants must indicate the post reference number on their applications. (Shortlisted candidates will receive communication from HR to submit certified copies of educational qualifications and other relevant documents not older than 6 months on or before the day of the interview). It is the applicant’s responsibility to have foreign qualifications evaluated by the South African Qualifications Authority (SAQA). All foreign qualification must be accompanied by evaluation certificate from the South African Qualification Authority (SAQA). Correspondence will only be limited to shortlisted candidates. Suitable candidates will be subjected to vetting and personnel pre-employment suitability checks (criminal record, citizenship, credit record checks, qualification verification and employment verification). Where applicable, candidates will be subjected to a skills/knowledge test. Medical Surveillance will be conducted on the recommended candidates. It is Department’s intention to promote representivity (race, gender, and disability) in the Public Service through the filling of these posts. The Department reserves the right not to appoint/fill this post. NB: The Public Service does not charge any fees for applying for posts. Should you be asked for a fee, please let the authorities know. PEOPLE WITH DISABILITY ARE ENCOURAGED TO APPLY.",Department of Health,STEVE BIKO ACADEMIC HOSPITAL,15-01-2024,"['Do you have an Appropriate NQF level 6 in Human Resource with 3-5 years’ relevant experience in the field?', 'Do you have knowledge of the PERSAL system?', ""Do you have a valid driver's license?""]","Due to the large number of applications we envisage receiving, applications will not be acknowledged. If you 
                                                    do not receive any response within 3 months, please accept that your application was not successful."
https://jobs.gauteng.gov.za/Public/ViewJob.aspx?u=dhnOO+xQuX7ga/jCzma2AQ==,refs/019554,Monitoring and Evaluation,1,R 1 214 805 – R 1 288 095.00 per annum (inclusive package),"Acting CEO: Dr. M.J. Mathabathe, Tel No: 011 923 2320","Appropriate qualification accredited with HPCSA that allows registration as a Medical Specialist. Plus, a qualification in Public Health Medicine (MMED) or a Fellowship of the College of Public Health Medicine of South Africa. An appropriate experience in Monitoring and evaluation of health programs. Knowledge in health measurement and informatics, and experience in using WebDHIS will be an added advantage. Knowledge and experience in hospital management and quality assurance. Skills required include project management; computer and communication.","Ensure the implementation of strategic development and operational plans for the hospital and monitor the development thereof. To ensure alignment to Provincial strategic goals and objectives. To oversee hospital data collection, coalition, and reporting by managing the Health Information Unit and Monitoring and Evaluation Unit. To support planning specifically for tertiary services provided under NTSG and monitor reporting in line with grant requirements. To ensure good quality, timely data is available for decision-making. To oversee the Quality Assurance Department.","Applications can be hand-delivered to the Human Resource Office, Tembisa Provincial Tertiary Hospital, or be uploaded online at www.gautengonline.gov.za,  http://professionaljobcentre.gpg.gov.za, or emailed to TembisaHR2@gauteng.gov.za. Applications must be submitted on the new Z83 form. The application form is obtainable from any Public Service Department or on the internet at www.dpsa.gov.za/documents. The new Z83 must be fully completed (please refer to the left side of Z83 special notes for clarity), it must be initialed, signed, and completed in accordance with DPSA Circular 19 of 2022. Applicants are not required to submit copies of qualifications and other relevant documents on application but must submit a fully completed Z83 and an updated detailed Curriculum Vitae. The information on the new Z83 must correspond with the Curriculum Vitae. Only shortlisted candidates will be required/requested to submit certified copies of qualifications and other relevant documents on or before the interview. Personnel Suitability Checks (PSC) –Verification (Reference checks- Provide at least 3 of which one must be immediate supervisor, the Department shall reserve the right to conduct verification beyond names provided, where necessary. Failure to submit all the relevant information preceding the statement above will result in disqualifying the candidate. Applicants will be subjected to Identity verification, qualifications verification, criminal record checks, credit/financial stability checks, and employment verification. 
If you have not been contacted within three (3) months after the closing date, please accept that your application was unsuccessful. Candidates in possession of a foreign qualification must furnish the Department with an evaluation certificate from the South African Qualifications Authority (SAQA). The recommended candidates may be subjected to medical surveillance as required by the Occupational Health and Safety Act, Act 5/1993. TPTH reserves the right to utilize practical exercises/tests for non-SMS positions during the recruitment process to determine the suitability of candidates for the post(s). The Department reserves the right not to fill the post. The Gauteng Department of Health is guided by the principles of Employment Equity. People with disabilities are encouraged to apply.",Department of Health,Tembisa Provincial Tertiary Hospital,15-01-2024,"['Do you have appropriate qualification accredited with HPCSA that allows registration as a Medical Specialist?', ', Do you have a qualification in Public Health Medicine (MMED) or Fellowship of the College of Public Health Medicine of South Africa?', 'Do you have an appropriate experience in Monitoring and evaluation of health programs, knowledge in health measurement and informatics, and experience in using WebDHIS?']","Due to the large number of applications we envisage receiving, applications will not be acknowledged. If you 
                                                    do not receive any response within 3 months, please accept that your application was not successful."
https://jobs.gauteng.gov.za/Public/ViewJob.aspx?u=dhnOO+xQuX5soN0B4fmIlg==,refs/019556,Nursing Services (Occupational Health and Safety),1,"R 431,265 – R 497,193 per annum (plus benefits)","Mrs L Rose, Deputy Nursing Manager 011 470 9033","A Basic R425 qualification (i.e., diploma/ degree in nursing) or equivalent qualification that allows registration with the South African Nursing Council (SANC) as Professional Nurse plus a post basic qualification in Occupational Health and Safety Nursing. Current registration with SANC is a requirement. A minimum of 4 years appropriate/recognisable experience in nursing after registration as Professional Nurse with SANC in General Nursing. Must be computer literate. Preference will be given to candidates with relevant working experience. Knowledge/ course in an integrated Employee Health and Wellness programme will be an advantage. Strong writing and policy development skills. Ability to work under pressure and in changing environments. Ability to work independently with good interpersonal skills. Knowledge and understanding of all Nursing Legislation and Health Acts. Must work within the legal and ethical framework that governs the nursing profession and public service employees. The Professional Nurse must provide nursing care as part of the multidisciplinary team and actively participate in decision making.","Provision of optimal, holistic specialised nursing care with set standards and within a professional/ legal framework. Effective utilisation of Human and Material resources. Participation in training and research. Provision of support to Nursing Services. Maintain professional growth, ethical standards, and self-development. Promotion of a scientific, high quality nursing care that is cost effective and efficient.","Applications must be submitted on a duly completed new Z83 form. Candidates who apply online must also attach the new Z83 form. The Z83 application form is obtainable from any Public Service Department or on the internet at www.dpsa.gov.za/documents. The new Z83 must be fully completed (please refer to the left side of the Z83 special notes for clarity), it must be initialled and signed. Applicants are not required to submit copies of qualifications and other relevant documents on application but must submit a fully completed and updated Z83 form and a detailed CV. The information on the new Z83 must be the same with that of the CV. Only shortlisted candidates will be required/requested to submit certified copies of qualifications and other relevant documents on or before the day of the interview following communication from HR. Failure to submit any of the requested documents will result in the application not being considered. Hardcopy applications must be forwarded to Rahima Moosa Mother and Child Hospital, Admin Building, Cnr. Fuel and Oudtshoorn Street, Coronationville or be posted to Private Bag X20, Newclare 2112. The Provincial Government of Gauteng is committed to the achievement and maintenance of diversity in employment, especially of race, gender, and disability. It is a legislative requirement that all newly appointed staff members be subjected to Personnel Suitability Checks (PSC) – verification, upon appointment within the Department. This verification process entails reference checks, identity verification, qualifications verification, criminal record checks as well as a credit/financial stability check. Successful candidates will be subjected to OHS medical surveillance as required by HBA regulations within the OHS Act 85 of 1993. Correspondence will be limited to shortlisted candidates only.",Department of Health,RAHIMA MOOSA MOTHER AND CHILD HOSPITAL,16-01-2024,"['Do you have a Basic R425 qualification (i.e., diploma/ degree in nursing) or equivalent qualification that allows registration with the South African Nursing Council (SANC) as Professional Nurse plus a post basic qualification in Occupational Health and Safety Nursing?', 'Are you currently registered with SANC as Professional Nurse with a speciality in Occupational Health and Safety?', 'Do you have a minimum of 4 years appropriate/recognisable experience in nursing after registration as Professional Nurse with SANC in General Nursing?']","Due to the large number of applications we envisage receiving, applications will not be acknowledged. If you 
                                                    do not receive any response within 3 months, please accept that your application was not successful."
