link,reference_no,directorate,no_of_posts,package,enquiries,requirements,duties,notes,employer,location,closing_date,criteria_question,please_note
https://jobs.gauteng.gov.za/Public/ViewJob.aspx?u=dhnOO+xQuX7ke9CIIeZwiQ==,refs/019543,Medical Services,1,R906 540.00 – R1 491 627.00 per annum  (plus  benefits),Dr M. Kokota (0187881708),"An appropriate minimum qualification that is MBChB/MBBC that allows registration with the HPCSA as a Medical Practitioner. Proof of current registration with HPCSA . Grade 1: One must have completed community service, registered and have proof of the current registration with the HPCSA. Grade 2: A minimum of 5-year appropriate experience as Medical Officer with the HPCSA is required. Grade 3: A minimum of 10-year appropriate experience as Medical Officer after registration with the HPCSA is required.  Experience in general medical practice, mental health care, HAST, maternal and child health, trauma and use of current clinical protocols and guidelines in patient management. Clinical skills in patient – centered consultation, history taking, examination, investigation and management and ensuring continuity of patient care.  Good professional attitude/conduct, good communication skills, professionalism, good medical record keeping. Be able to work commuted overtime.","Supervise junior doctors (Community Service Doctors), Attend relevant administrative meetings like morbidity and mortality meetings and trainings in the hospital. Complete Medico legal documentation timeously (e.g. death certificate). Improve quality of care by providing appropriate clinical care. Reduce medical litigation by exercising good clinical ethics. Implement and monitor adherence to the ideal hospital framework. Participate in the multidisciplinary team approach to patient management. Ensure that administration and record keeping is done in the department. Be willing to participate in commuted overtime and after-hours duties to provide continuous uninterrupted care of patients.","Applications for the above mentioned post must be done on the following website: http:/www.professionaljobcenter@gpg.gov.za.Applications can be delivered to Carletonville Hospital:Corner Annan Road & Falcon Street or posted to The HR Directorate,Carletonville Hospital,Private Bag x 2023,2500.Due to technical problems with GPG vacancy website that the institution is consistently faced with, applicants are encouraged to apply using any of the above methods. Applications must be accompanied by a fully completed and signed new Z83 application form obtainable from any Public Service Department or on the internet at www.dpsa.gov.za, copy of a CV and proof of registration with HPCSA must be attached. Application without proof of a new z83 application form and detailed CV will be disqualified. Applicants must indicate the post reference number on their applications. Only shortlisted candidates will be required to submit their certified copies of identity book (ID) and qualifications during interviews. Failure to do so will lead into disqualification. The employer reserves the right to fill or not to fill the post. People with disabilities are encouraged to apply. Successful candidates will be subjected to OHS medical surveillance as required by HBA Regulations within OHS Act 85 of 1993.It is legislative requirement that all newly appointed staff members are subjected to Personnel Suitability Check(PSC)-Verification, upon appointment with the department. This verification processes entails reference checks, identity verification, qualification verification, criminal records checks and financial records check. Applicants must indicate the post reference number on their applications. Persons in possession of a foreign qualification must furnish the Department with an evaluation certificate from South African Qualifications Authority (SAQA). Due to the large number of applications we envisage receiving, applications will not be acknowledged. If you do not receive any response within 3 months, please accept that your application was not successful.",Department of Health,CARLETONVILLE HOSPITAL,12-01-2024,"['Do you have an appropriate minimum qualification that is MBChB/MBBC that allows registration with the HPCSA as a Medical Practitioner?', 'Do you have a Proof of current registration with HPCSA?', 'Grade 1:Have you completed community service, registered and have proof of the current registration with the HPCSA?', 'Grade 2: Do you have a minimum of 5-year appropriate experience as Medical Officer with the HPCSA is required?', 'Grade 3: Do you have a minimum of 10-year appropriate experience as Medical Officer after registration with the HPCSA is required?']","Due to the large number of applications we envisage receiving, applications will not be acknowledged. If you 
                                                    do not receive any response within 3 months, please accept that your application was not successful."
https://jobs.gauteng.gov.za/Public/ViewJob.aspx?u=dhnOO+xQuX7E69utkF64uQ==,refs/019544,Maxillo-Facial and Oral Surgery,2,R906 540.00-R947 046.00,"Prof M Mabongo
Tel:012 319 2322/2678","BChD/BDS or equivalent qualification. Registered with HPCSA as a dentist in the category of Independent Practice. Minimum of two(2) years' experience as an independent dental practitioner. Successful completion of primary examinations with the College of Medicine of South Africa or University of Pretoria, or any University with reciprocity concerning anatomy, physiology, and anatomical pathology.
Recommendations: A postgraduate qualification in Oral Surgery(Postgraduate Diploma/MSC).Current ATLS certification/Proof of a confirmed for the ATLS examination. Experience in teaching at the undergraduate level, including student supervision. A track record in research and publication. Proven exposure to clinical activities related to Maxillofacial and Oral Surgery. Proven attendance at maxillofacial activities(Conferences, seminars, workshops, etc.)",Deliver academic seminars within the department. Conduct research as a minimum requirement. Participate in under-and postgraduate teaching activities of the department. Render services across all platforms of the department. The successful candidate will be expected to work in all clinical  platforms of the department. Present academic work in national and international academic platforms.,"Applications: Quoting the relevant reference number. Direct applications must be delivered to Human Resources Management at Louis Botha A Building, Dr Savage Road, Riviera, Pretoria or mail  to P.O. Box 1266,Pretoria,0001.
No faxed or emailed applications will be considered. Fully completed new Z83 and detailed curriculum vitae with minimum of at least three (3) referees. Certified documents will only be requested to shortlisted candidates on or before the day of the interview. Applications must be submitted timeously ,applications received after the closing date will not be accepted. The department reserves the right not to  make n appointment. Candidates will be expected to be available for selection interviews on the date, time, and place determined by the Department. Correspondence will be limited to shortlisted candidates only, if you have not heard from us within 3 months of closing date, please accept that your applications has been unsuccessful.",Department of Health,University Of Pretoria Oral Health Centre,12-01-2024,[],"Due to the large number of applications we envisage receiving, applications will not be acknowledged. If you 
                                                    do not receive any response within 3 months, please accept that your application was not successful."
https://jobs.gauteng.gov.za/Public/ViewJob.aspx?u=dhnOO+xQuX7XcRQKx7GlGA==,refs/019545,NURSING,1,R627 474 – 724 278 PER ANNUM  (plus benefits),Ms M.M.M.Makosholo – 018 788 1704,"Diploma/degree in Nursing as a Professional Nurse accredited with the South African Nursing Council in terms of Government Notice 425. A minimum of 8 years appropriate/recognisable experience in nursing after registration as a Professional Nurse with the South African Nursing Council in General Nursing. At least 3 years of the period referred to above must be appropriate/recognisable experience at management level as an Operational Manager. Diploma/degree in Nursing Management is mandatory, Knowledge of Health, Nursing and Public Service Legislation is recommended. Strong leadership skills, computer literacy, good communication and sound interpersonal skills are necessary.","Provide effective supervision and leadership for staff  in allocated clinical areas in line with all relevant legislation and prescripts. Delegate, supervise and co-ordinate the provision of effective and efficient patient care through adequate nursing care.  Initiate and participate in health promotion to ensure consistent communication of relevant, accurate and comprehensive information on health care. Develop/establish and maintain constructive working relationships with nursing and other stakeholders (i.e., inter-professional, inter-sectoral and multi-disciplinary teamwork). Participate in the analysis, formulation and implementation of nursing guidelines, practices, standards, and procedures. Manage Human Resources. Monitor and ensure proper utilization of financial and physical resources. Provision of effective support to Nursing Services. Initiate programs that will ensure quality nursing care. Participate in the analysis, formulation of nursing guidelines, norms and standards. Ensure implementation monitoring and promotion of Quality Assurance programs (Daily patient opinion survey, complaints management, patient safety management, patient waiting times), Infection Prevention and Control and Health and Safety principles. Promote quality nursing care as directed by Office of Health Standard Compliance (OHSC) & Ideal Hospital Realization and Maintenance Framework. Implement relevant recommendations and priorities of the National Strategic plan for Nurse education, training, and Practice. Participate in after hour call, day/night supervision, shifts and weekends as per service need. Participate in development and implementation of the Hospital Operational Plan. Monitor performance using Performance Management and Development System.","Applications for the above mentioned post must be done on the following website: http:/www.professionaljobcenter@gpg.gov.za.Applications can be delivered to Carletonville Hospital:Corner Annan Road & Falcon Street or posted to The HR Directorate,Carletonville Hospital,Private Bag x 2023,2500.Due to technical problems with GPG vacancy website that the institution is consistently faced with, applicants are encouraged to apply using any of the above methods. Applications must be accompanied by a fully completed and signed new Z83 application form obtainable from any Public Service Department or on the internet at www.dpsa.gov.za, copy of a CV and proof of registration with South African Nursing Council must be attached. Application without proof of a new z83 application form and detailed CV will be disqualified. Applicants must indicate the post reference number on their applications. Only shortlisted candidates will be required to submit their certified copies of identity book (ID) and qualifications during interviews. Failure to do so will lead into disqualification. The employer reserves the right to fill or not to fill the post. People with disabilities are encouraged to apply. Successful candidates will be subjected to OHS medical surveillance as required by HBA Regulations within OHS Act 85 of 1993.It is legislative requirement that all newly appointed staff members are subjected to Personnel Suitability Check(PSC)-Verification, upon appointment with the department. This verification processes entails reference checks, identity verification, qualification verification, criminal records checks and financial records check. Applicants must indicate the post reference number on their applications. Persons in possession of a foreign qualification must furnish the Department with an evaluation certificate from South African Qualifications Authority (SAQA). Due to the large number of applications we envisage receiving, applications will not be acknowledged. If you do not receive any response within 3 months, please accept that your application was not successful.",Department of Health,CARLETONVILLE HOSPITAL,12-01-2024,"['Do you have a Diploma/degree in Nursing as a Professional Nurse accredited with the South African Nursing Council in terms of Government Notice 425?', 'Do you have a minimum of 8 years appropriate/recognisable experience in nursing after registration as a Professional Nurse with the South African Nursing Council in General Nursing. At least 3 years of the period referred to above must be appropriate/recognisable experience at management level as an Operational Manager?', 'Do you have a Diploma/degree in Nursing Management?', 'Are you computer literate?']","Due to the large number of applications we envisage receiving, applications will not be acknowledged. If you 
                                                    do not receive any response within 3 months, please accept that your application was not successful."
https://jobs.gauteng.gov.za/Public/ViewJob.aspx?u=dhnOO+xQuX78xxyeNffOgA==,refs/019546,NURSING,1,R431 265 – 497 193 PER ANNUM  (plus benefits),Ms M.M.M.Makosholo – 018 788 1704,"Basic qualification accredited with South African Nursing Council in terms of Government Notice 425 i.e. Diploma/Degree in Nursing as a Professional nurse or equivalent qualification that allows registration with SANC as a Professional Nurse. Post-Basic Nursing qualification with a duration of at least 1 year, accredited with SANC in terms of Government Notice No. R212 in the specialized area (Midwifery). A minimum of 4 years appropriate/recognizable experience in Nursing after registration as Professional Nurse with SANC in General Nursing. Competencies: Leadership, Management and Communication skills. Ability to take charge, leading the shifts and mentor midwives in the unit.  Display concern for patients, promoting and advocating proper treatment and care including awareness and willingness to respond to patients’ needs, requirements and expectations (Batho Pele Principles). Able to plan and organize own work and that of support personnel to ensure proper nursing care. Knowledge of grievance and disciplinary procedure. Knowledge of infection prevention and control and occupational health and safety practices. Understanding of National Core Standards and, Ideal Hospital Realization and Maintenance Framework.","Provision of optimal, holistic specialized nursing care services with set standards and ensure compliance with recommendations of the Saving mothers and babies report. Manage effectively the utilization of resources. i.e. Human, Material, and monitoring of the services. Provision of support on nursing services, assisting with the relief of duties of the supervisor and acting as shift leader on both day and night shifts, to partake in overall specialized unit functions. Perform a clinical nursing practice in accordance with the scope of practice and Nursing standards. Maintain professional growth/ethical standards and self-development. Promote quality nursing care as directed by the Professional scope of practice and standard. Participate in preparation, and attend maternal and morbidity meetings monthly. Provide in-service education in managing maternal and neonatal complications, including drills. Ensure compliance with Ideal Hospital Realization Framework guidelines, PSI and complaints management.","Applications for the above mentioned post must be done on the following website: http:/www.professionaljobcenter@gpg.gov.za.Applications can be delivered to Carletonville Hospital:Corner Annan Road & Falcon Street or posted to The HR Directorate,Carletonville Hospital,Private Bag x 2023,2500.Due to technical problems with GPG vacancy website that the institution is consistently faced with, applicants are encouraged to apply using any of the above methods. Applications must be accompanied by a fully completed and signed new Z83 application form obtainable from any Public Service Department or on the internet at www.dpsa.gov.za, copy of a CV and proof of registration with South African Nursing Council must be attached. Application without proof of a new z83 application form and detailed CV will be disqualified. Applicants must indicate the post reference number on their applications. Only shortlisted candidates will be required to submit their certified copies of identity book (ID) and qualifications during interviews. Failure to do so will lead into disqualification. The employer reserves the right to fill or not to fill the post. People with disabilities are encouraged to apply. Successful candidates will be subjected to OHS medical surveillance as required by HBA Regulations within OHS Act 85 of 1993.It is legislative requirement that all newly appointed staff members are subjected to Personnel Suitability Check(PSC)-Verification, upon appointment with the department. This verification processes entails reference checks, identity verification, qualification verification, criminal records checks and financial records check. Applicants must indicate the post reference number on their applications. Persons in possession of a foreign qualification must furnish the Department with an evaluation certificate from South African Qualifications Authority (SAQA). Due to the large number of applications we envisage receiving, applications will not be acknowledged. If you do not receive any response within 3 months, please accept that your application was not successful.",Department of Health,CARLETONVILLE HOSPITAL,12-01-2024,"['Do you have a Basic qualification accredited with South African Nursing Council in terms of Government Notice 425 i.e. Diploma/Degree in Nursing as a Professional nurse or equivalent qualification that allows registration with SANC as a Professional Nurse?', 'Do you have a  Post-Basic Nursing qualification with a duration of at least 1 year, accredited with SANC in terms of Government Notice No. R212 in the specialized area (Midwifery)?', 'Do you a minimum of 4 years appropriate/recognizable experience in Nursing after registration as Professional Nurse with SANC in General Nursing?']","Due to the large number of applications we envisage receiving, applications will not be acknowledged. If you 
                                                    do not receive any response within 3 months, please accept that your application was not successful."
https://jobs.gauteng.gov.za/Public/ViewJob.aspx?u=dhnOO+xQuX44MBszq7TMNw==,refs/019552,Nursing Services (General),2,R627 474 - R724 278 per annum (plus benefits),Ms L Rose (Deputy Manager Nursing) 011 470 9033,"Basic qualification accredited with SANC in terms of Government Notice 425 or equivalent qualification that allows registration with SANC as a Professional Nurse with midwifery. Registration with SANC as Professional Nurse with midwifery. A minimum of 8 years appropriate/recognisable experience in nursing after registration as Professional Nurse with SANC in General Nursing. At least 3 years of the period referred to above must be appropriate/recognisable experience at management/shift leader level, preferably operational manager level. A Management qualification will be an advantage. The candidate must be able to work in a busy high-pressured environment and lead a team to resolve conflict, maintain quality patient care and work within the legal and ethical framework that governs the profession. Manage staff, adhere to cost containment measures, and provide supervision to subordinates and multidisciplinary staff. Ability to work independently. Manage human resources, leave management and performance management. Good communication and report writing skills. Knowledge of nursing care processes and procedures, nursing statutes, and other relevant legal frameworks such as: Nursing Act, Health Act, OHS Act, Patient Rights Charter, Batho-Pele principles, Public Service regulations, Labour Relations Act, Disciplinary Code and Procedure, Grievance Procedure, etc. Skills: Leadership, organizational, decision making, problem-solving abilities, goods communication, good supervisory and the ability to work within the limit of the public sector and institutional policy framework. This is a permanent night duty post the candidate must adhere to all policies required for this post, shift work, weekends and public holidays. Must be computer literate (Microsoft word, Excel, PowerPoint, outlook) and be able to analyse data. The candidate must be able to demonstrate basic computer skills at the interview and complete a short Quality Improvement Plan as part of the introduction, immediately before the interview.","Coordination of optimal, holistic specialised nursing care provided within set standards of a professional/ legal framework. Effectively manage the utilisation and supervision of human, financial and material resources. Co-ordination of the provision of effective training and research. Provision of effective support to nursing services. Maintain professional growth, ethical standards, and self-development. Compilation of midnight statistics, Report writing, monitoring and reporting of patient safety incidents to relevant departments according to guidelines and internal Standard operating procedures. Work closely with the medical superintendent on call.","Applications must be submitted on a duly completed new Z83 form. Candidates who apply online must also attach the new Z83 form.  The new Z83 must be fully completed (please refer to the left side of the Z83 special notes for clarity), it must be initialled and signed. Applicants are not required to submit copies of qualifications and other relevant documents on application but must submit a fully completed and updated Z83 form and a detailed CV. The information on the new Z83 must be the same with that of the CV. Only shortlisted candidates will be required/requested to submit certified copies of qualifications and other relevant documents on or before the day of the interview following communication from HR. Failure to submit any of the requested documents will result in the application not being considered. Hardcopy applications must be forwarded to Rahima Moosa Mother and Child Hospital, Admin Building, Cnr. Fuel and Oudtshoorn Street, Coronationville or be posted to Private Bag X20, Newclare 2112. The Provincial Government of Gauteng is committed to the achievement and maintenance of diversity in employment, especially of race, gender, and disability. It is a legislative requirement that all newly appointed staff members be subjected to Personnel Suitability Checks (PSC) – verification, upon appointment within the Department. This verification process entails reference checks, identity verification, qualifications verification, criminal record checks as well as a credit/financial stability check. Successful candidates will be subjected to OHS medical surveillance as required by HBA regulations within the OHS Act 85 of 1993. Correspondence will be limited to shortlisted candidates only.",Department of Health,RAHIMA MOOSA MOTHER AND CHILD HOSPITAL,12-01-2024,"['Do you have a basic qualification accredited with SANC in terms of Government Notice 425 or equivalent qualification that allows registration with SANC as a Professional Nurse with midwifery?', 'Are you registered with SANC as Professional Nurse with midwifery?', 'Do you have a minimum of 8 years appropriate/recognisable experience in nursing after registration as Professional Nurse with SANC in General Nursing?', 'Do you have at least 3 years appropriate/recognisable experience at management/shift leader level, preferably operational manager level?']","Due to the large number of applications we envisage receiving, applications will not be acknowledged. If you 
                                                    do not receive any response within 3 months, please accept that your application was not successful."
