link,reference_no,directorate,no_of_posts,package,enquiries,requirements,duties,notes,employer,location,closing_date,criteria_question,please_note
https://jobs.gauteng.gov.za/Public/ViewJob.aspx?u=0Rdme3qCDA43C1KIft/zUw==,REFS/019559,Forensic Pathology Service,2,Grade 1: R 436.00 per hour  	   Grade 2: R 498.00 per hour     Grade 3: R 576.00 per hour,Dr T.Z Nkondo (082) 781 7632,"Appropriate qualification (MBBCh / MBChB) that allows registration with the HPCSA as a MEDICAL PRACTITIONER and proof of current registration; Grade 1: No experience required after registration as MEDICAL PRACTITIONER with the HPCSA; Grade 2: A minimum of 5 years’ appropriate experience after registration with HPCSA as a MEDICAL PRACTITIONER; Grade 3: A minimum of 10 years’ appropriate experience after registration with HPCSA as a MEDICAL PRACTITIONER. Ability and willingness to perform medico-legal death investigations, including performance of forensic autopsies; expected to give evidence in Courts and willingness to perform duties outside of normal hours and away from base of employment when required. A valid driver’s licence; and computer literacy (MS Word, Outlook, Excel and PowerPoint). Willingness to obtain the CMSA Dip For Med (SA) qualification within 1 year to 24 months; Good working knowledge of relevant FPS legislation; Good written and verbal communication skills and interpersonal skills.","Providing comprehensive medico-legal investigation of death services, performance of forensic post mortem examinations including medico-legal autopsies,  inclusive after-hour services during the week and over weekends, , preparation of relevant medico-legal reports and court attendance; Supporting the implementation of a standardised, quality forensic pathology service; Completing documents for statistical and data analysis purposes; Participation in academic activities in the Department; Assisting the Head: of Clinical Department and Head of Clinical Unit in service and management duties; Rendering other related professional services and duties as may be assigned from time to time.","Gauteng Forensic Medical Services is committed to the pursuit of diversity, redress and will promote representation in terms of race, disability and gender. Applications must consist of a fully completed and signed new Z83 form with a comprehensive CV containing contactable references. In compliance to DPSA Circular 19 of 2022 certifying documents / qualifications will only be requested from the shortlisted candidates before the interview process (Applicants are not required to submit copies of qualifications and other relevant documents when applying). The relevant reference number must be quoted in the application form. In terms of the National Qualification Framework Amendment Act 2019 it is an offence for any person to falsely or fraudulently claim to hold a qualification. Any person found to be misrepresenting their qualifications, work experience or facts in their CV will be disqualified and reported to the appropriate authority. Please note that the interviews will also include a technical evaluation of computer and driving skills. The recommended candidates will be subjected Personnel suitability check (Medical Surveillance and Criminal Record). Applications must be delivered to: Forensic Medical Services 11 Diagonal Street 13 floor, reception, can be posted to:  Forensic Medical Services P.O Box 7128 Johannesburg 2000. Due to technical problems with GPG vacancy website that the institution is consistently facing, applicants are encouraged to apply using hand delivery, or the postal address.",Department of Health,Johannesburg FPS x2,17-01-2024,"['Do you have an appropriate qualification that allows registration with the HPCSA as Medical Officer', 'Are you computer literate', 'Do you have a valid driver’s license', 'Do you have knowledge of relevant FPS policies']","Due to the large number of applications we envisage receiving, applications will not be acknowledged. If you 
                                                    do not receive any response within 3 months, please accept that your application was not successful."
https://jobs.gauteng.gov.za/Public/ViewJob.aspx?u=dhnOO+xQuX5aJHfvi+VqVw==,refs/019560,Nursing Services,18,"GRADE 1 R 194,00 PER HOUR 	     GRADE 2 R 237,00 PER HOUR 	     GRADE 3 R 285,00 PER HOUR",Ms L Rose Deputy Nursing Manager   011 470 9033,"Basic R 425 qualification, i.e., Diploma/Degree in nursing that allows registration with the South African Nursing Council as Professional Nurse with Midwifery. Proof of current registration with the South African Nursing Council as a Professional Nurse with Midwifery. Experience of working in a mother and child facility or operating theatre. They must work within the legal and ethical framework that governs the nursing professional and public service employees. The professional nurse must provide nursing care as part of the multidisciplinary team and actively participate in decision making within the scope of there practice, in the best interest of quality patient care in a mother and child hospital. They must be prepared to work shifts according to the needs of the department, both day and night shift excluding public holidays and Sundays. Overtime is not included in the package. 
GRADE 1: Less than 10 years relevant experience after registration as professional nurse. 
GRADE 2: At least 10 years, but less than 20 years relevant experience after registration as professional nurse.
GRADE 3: 20 years and more relevant experience after registration as professional nurse.","Provision of optimal, holistic specialised nursing care with set standards and within a professional/ legal framework. Effective utilisation of Human and Material resources. Participation in training and research. Provision of support to Nursing Services. Maintain professional growth, ethical standards, and self-development. Promotion of a scientific, high quality nursing care that is cost effective and efficient.","Applications must be submitted on a duly completed new Z83 form. The new Z83 must be fully completed (please refer to the left side of the Z83 special notes for clarity), it must be initialled and signed. Applicants are not required to submit copies of qualifications and other relevant documents on application but must submit a fully completed Z83 form and a detailed CV. Please indicate on CV if you are currently registered with SANC. Only shortlisted candidates will be required/requested to submit certified copies of qualifications and other relevant documents on or before the day of the interview following communication from HR. Failure to submit any of the requested documents will result in the application not being considered. Hardcopy applications must be forwarded to Rahima Moosa Mother and Child Hospital, Admin Building, Cnr. Fuel and Oudtshoorn Street, Coronationville or be posted to Private Bag X20, Newclare 2112. The Provincial Government of Gauteng is committed to the achievement and maintenance of diversity in employment, especially of race, gender, and disability. It is a legislative requirement that all newly appointed staff members be subjected to Personnel Suitability Checks (PSC) – verification, upon appointment within the Department. This verification process entails reference checks, identity verification, qualifications verification, criminal record checks as well as a credit/financial stability check. Successful candidates will be subjected to OHS medical surveillance as required by HBA regulations within the OHS Act 85 of 1993. Correspondence will be limited to shortlisted candidates only.",Department of Health,RAHIMA MOOSA MOTHER AND CHILD HOSPITAL,17-01-2024,"['Do you have a basic R 425 qualification, i.e., Diploma/Degree in nursing that allows registration with the South African Nursing Council as Professional Nurse with Midwifery?', 'Do you have proof of current registration with the South African Nursing Council as a Professional Nurse with Midwifery?', 'Do you have experience of working in a mother and child facility or operating theatre?']","Due to the large number of applications we envisage receiving, applications will not be acknowledged. If you 
                                                    do not receive any response within 3 months, please accept that your application was not successful."
https://jobs.gauteng.gov.za/Public/ViewJob.aspx?u=dhnOO+xQuX4c7BYKMphcoA==,refs/019555,Obstetrics and Gynaecology,1,R 1 214 805.00 – R 1 288 095 .00 per annum (inclusive package),Dr. B.S.S. Nkosi  (011) 923 2255/ 2030,Appropriate qualification that allows registration with the Health Professions Council of South Africa (HPCSA) as a Medical Specialist in Obstetrics and Gynaecology. Registration with the HPCSA as Medical Specialist in Obstetrics and Gynaecology. No experience required after registration with the HPCSA as a Medical Specialist.,"Strengthen obstetrics and gynaecological health services in the institution. Participate in clinical governance structures in the department, institution, cluster, and Province. Promote clinical effectiveness in all facilities. Support cluster hospitals with all aspects of service delivery related to obstetrics and gynaecology cluster. Secondarily support clinics, community health centers, and primary health care outreach teams, including engaging with private sector obstetrics and gynaecologist with service delivery-related matters. Facilitate and participate in the training, development, and mentorship of under and post graduate students. This includes supporting the HOD in providing leadership and participation in teaching and research supervision. Work with public health and the district's clinical specialist teams (DCST) to establish and maintain systems including surveillance, health information, communication, referral guidelines, and processes to support the delivery of obstetrics and gynaecological services. Initiate, support, and participate in clinical audit and quality improvement cycles with a specific focus on obstetrics and gynaecology. Implement effective monitoring and evaluation processes. Effective use of data and appropriate reporting on outputs and health outcomes. Initiative, support, or participate in relevant research. Foster effective teamwork and collaboration within the cluster, DCST, and University. Enable and support engagement with the local community, relevant non-government organizations, and private providers. Facilitate and ensure effective communication with all management structures within the hospital, the district, the cluster, and the province and assist in providing regular reports on activities and initiatives to save mothers, babies, and children. Assist with the strategic and operational planning of services in the hospital, cluster, and province. Assist with the coordination and supervision of obstetrics and gynaecological services within the cluster and management of relevant human resources. Assist with recruitment processes in the department, academic circuit, and cluster. Perform any other duties as requested by the department.","Applications can be hand-delivered to the Human Resource Office, Tembisa Provincial Tertiary Hospital, or be uploaded online at www.gautengonline.gov.za,  http://professionaljobcentre.gpg.gov.za, or emailed to TembisaHR1.HR@gauteng.gov.za. Applications must be submitted on the new Z83 form. The application form is obtainable from any Public Service Department or on the internet at www.dpsa.gov.za/documents. The new Z83 must be fully completed (please refer to the left side of Z83 special notes for clarity), it must be initialed, signed, and completed in accordance with DPSA Circular 19 of 2022. Applicants are not required to submit copies of qualifications and other relevant documents on application but must submit a fully completed Z83 and an updated detailed Curriculum Vitae. The information on the new Z83 must correspond with the Curriculum Vitae. Only shortlisted candidates will be required/requested to submit certified copies of qualifications and other relevant documents on or before the interview. Personnel Suitability Checks (PSC) –Verification (Reference checks- Provide at least 3 of which one must be immediate supervisor, the Department shall reserve the right to conduct verification beyond names provided, where necessary. Failure to submit all the relevant information preceding the statement above will result in disqualifying the candidate. Applicants will be subjected to Identity verification, qualifications verification, criminal record checks, credit/financial stability checks, and employment verification. If you have not been contacted within three (3) months after the closing date, please accept that your application was unsuccessful. Candidates in possession of a foreign qualification must furnish the Department with an evaluation certificate from the South African Qualifications Authority (SAQA). The recommended candidates may be subjected to medical surveillance as required by the Occupational Health and Safety Act, Act 5/1993. TPTH reserves the right to utilize practical exercises/tests for non-SMS positions during the recruitment process to determine the suitability of candidates for the post(s). The Department reserves the right not to fill the post. The Gauteng Department of Health is guided by the principles of Employment Equity. People with disabilities are encouraged to apply.",Department of Health,Tembisa Provincial Tertiary Hospital,18-01-2024,"['Do you have an appropriate qualification that allows registration with the Health Professions Council of South Africa (HPCSA) as a Medical Specialist in Obstetrics and Gynaecology?', 'Are you registered with the HPCSA as Medical Specialist in Obstetrics and Gynaecology?']","Due to the large number of applications we envisage receiving, applications will not be acknowledged. If you 
                                                    do not receive any response within 3 months, please accept that your application was not successful."
https://jobs.gauteng.gov.za/Public/ViewJob.aspx?u=dhnOO+xQuX4OMCSJaPO+KQ==,refs/019558,Surgery Department,1,R 1 214 805. 00 (per annum) (All-inclusive package),Prof T.E. Luvhengo Tel: 011 488 3373 Ms M.P. Rapetswa Tel 011 488 3711,"Appropriate qualification that allows for registration with HPCSA as a Medical Specialist in Surgery. Registration with the HPCSA as Medical Specialist in Surgery. No experience required after registration with the HPCSA as Medical Specialist in Surgery. The following will be added advantage: Experience working as a General Surgeon in the Public Sector. Knowledge of legislation, policies and procedures pertaining to health care users in the public sector.","Supervising the management of and managing patients with benign and malignant colorectal diseases. Surgical skillset to manage general and colorectal surgical patients with the ability to supervise and perform open and laparoscopic surgery. Supervise and perform emergency operations and do surgical sessions at CMJAH Cluster Hospital.  It is required to be able to perform Endoscopy- Gastroscopy and Colonoscopy+/- intervention. Engage in multidisciplinary management of comprehensive colorectal cancers and outpatient follow-up clinics to facilitate adequate service delivery to patients with colorectal diseases. Participation in research.  Ability to manage a team of junior doctors, providing support and leadership. Teaching and training of interns, medical officers and registrar undergraduate teaching ward rounds. Provision of undergraduate and postgraduate medical student teaching, provision of supervision and training of surgical registrars in surgery. Ability to establish excellent working relationship with anaesthetic team, emergency unit nursing team, ward nursing team and oncology nursing team. Good leadership skills, excellent communication (verbal and written), conflict resolution and good interpersonal skills. The successful candidate must be adaptable, disciplined, and self-confident. The candidate must be able to work independently and under pressure and beyond the normal working hours and work with a diverse team. Ability to work in a multidisciplinary team. Administrative duties within the department. Co- ordinating logistics and obtaining equipment and pharmaceuticals. Ability to initiate and conduct research. The appointed candidate will be expected to strengthen the regional and district health systems by providing outreach programmes. Be a role model for students and staff. Participate in all divisional departmental and faculty meetings in order to facilitate effective teaching and research as well as to enhance continuing professional development. Perform duties assigned by the Head of Department of Health. Maintain quality assurance standards and other departmental policies. Attend meetings and training as approved by the Head of Unit. Comply with the Performance Management and Development System (contracting, quarterly reviews and final assessment)","Application should be submitted strictly online (on a PDF Format only) at the following e-mail: Medicalhr.Cmjah@gauteng.gov.za. Only online applications will be considered. Please use the reference as the subject. Please note that salary will be adjusted according to years of experience as per OSD Policy. The new Z83 must be fully completed (please refer on the left side of Z83 special notes for clarity), it must be initialed and signed. On the Z83 the Department where position was advertised it should state Department of Health. According to Department of Public Service and Administration (DPSA) Circular 19 of 2022, applicants are not required to submit copies of qualifications and other relevant documents on application but must submit a fully completed Z83 and a detailed Curriculum Vitae only. The Curriculum Vitae should be recently updated that specifies the following: All experience should be in a chronological order indicating the position, institution and respective dates indicating the starting and ending period (DD/MM/YYYY). The information on the new Z83 must be in sync with the Curriculum Vitae. Only shortlisted candidates will be required/requested to submit certified copies of qualifications and other relevant documents on or before the interview. Personnel Suitability Checks (PSC) –Verification (Reference checks- Provide at least 3 off which one must be immediate supervisor and must be contactable, the Department shall reserve the right to conduct verification beyond names provided, where necessary. Failure to submit all the relevant information preceding the statement above will result in disqualifying the candidate. Identity verification, qualifications verification, criminal record checks, credit/financial stability checks and employment verification. If you have not been contacted within three (3) months after the closing date, please accept that your application was unsuccessful. Candidates in possession of a foreign qualification must furnish the Department with an evaluation certificate from the South African Qualifications Authority (SAQA) (Only when shortlisted). The recommended candidate may be subjected to medical surveillance as required by the Occupational Health and Safety Act, Act 5/1993. Institutions reserves the right to utilize practical exercises/tests for non-SMS positions during the recruitment process to determine the suitability of candidates for the post(s). The Department reserve the right not to fill the post. The Gauteng Department of Health is guided by the principles of Employment Equity. People with disabilities, Coloured  Males, Coloured Females, Indian Females, White Males, White Females, African Females, African Males and Indian Males  are encouraged to apply.",Department of Health,Charlotte Maxeke Johannesburg Academic Hospital,18-01-2024,['Do you have an Appropriate qualification that allows for registration with HPCSA as a Medical Specialist in Surgery?'],"Due to the large number of applications we envisage receiving, applications will not be acknowledged. If you 
                                                    do not receive any response within 3 months, please accept that your application was not successful."
https://jobs.gauteng.gov.za/Public/ViewJob.aspx?u=dhnOO+xQuX7B5V159WfbiA==,refs/019563,Internal Medicine,7,R 906 540.00 (per annum) (All-inclusive - package),"Prof A. Mahomed TEL 011 488 3654/3554 
Ms M.P. Rapetswa TEL 011 488 3711","Appropriate qualifications that allow registration with HPCSA as Medical Practitioner. Registration with  the  HPCSA  as a Medical Practitioner. No experience required after registration with HPCSA as Medical Practitioner. The following will be  added advantage: Preference will be given to candidates with   ACLS, AMLS, Diploma in HIV Management, Diploma in Internal Medicine AND experience in teaching and research and medical registrar work experience.","As a Medical Officer in Internal Medicine, the candidate will be expected to rotate between working both General Internal medicine and Medical subspecialities. In  General, Internal Medicine, the candidate will be responsible for the clinical management of general  medical patients within any of the Wits affiliated training hospitals. They will supervise community service medical officers, junior registrars and interns and liaise with their senior consultants daily regarding this. They will be required to perform and teach diagnostic and therapeutic procedures concordant with a senior medical officers training in this regard. Other clinical duties will include managing patients at MOPD, managing patients attending the subspecialty OPD or specialty ward consultations within a relevant sub-specialty. The desired candidate will be required to set an appropriate example of an exemplary medical practitioner and serve as a role model and clinical mentor to junior doctors and associated clinical staff.  ESSENTIAL SKILLS: Patient first mentality; General management skills; excellent communication skills; good professional judgement; intergrity and professional dependability; leadership experience; conflict management; cost-containment. Management training and experience; technology and computer skills; problem-solving experience; coaching and mentoring experience. ACADEMIC: Performance of research within the department.  Supervision of research within the department and/or MMed will required as per experience and prior degrees.","Please note that the salary will be adjusted according to years of experience as per OSD policy. Applications should be uploaded online (PDF Format only) at the following e-mail:  Medicalhr.Cmjah@gauteng.gov.za. Only online applications  will be considered. The new Z83 must be fully completed (please refer on the left side of Z83 special notes for clarity), it must be initialed and signed. On the Z83 the Department where position was advertised it should state Department of Health. According to Department of Public Service and Administration (DPSA) Circular 19 of 2022, applicants are not required to submit copies of qualifications and other relevant documents on application but must submit a fully completed Z83 and a detailed Curriculum Vitae. The Curriculum Vitae should be recently updated that specifies the following: All experience should be in a chronological order indicating the position, institution and respective dates indicating the starting and ending period (DD/MM/YYYY). The information on the new Z83 must be in sync with the Curriculum Vitae. Only shortlisted candidates will be required/requested to submit certified copies of qualifications and other relevant documents on or before the interview. Personnel Suitability Checks (PSC) –Verification (Reference checks- Provide at least 3 off which one must be immediate supervisor and must be contactable, the Department shall reserve the right to conduct verification beyond names provided, where necessary. Failure to submit all the relevant information preceding the statement above will result in disqualifying the candidate. Identity verification, qualifications verification, criminal record checks, credit/financial stability checks and employment verification. If you have not been contacted within three (3) months after the closing date, please accept that your application was unsuccessful. Candidates in possession of a foreign qualification must furnish the Department with an evaluation certificate from the South African Qualifications Authority (SAQA) (Only when shortlisted). The recommended candidate may be subjected to medical surveillance as required by the Occupational Health and Safety Act, Act 5/1993. Institutions reserves the right to utilize practical exercises/tests for non-SMS positions during the recruitment process to determine the suitability of candidates for the post(s). The Department reserve the right not to fill the post. The Gauteng Department of Health is guided by the principles of Employment Equity. People with disabilities, Coloured Males, Coloured Females, White Males, Indian Males,  Indian Females, African Males, African Females and White Females  are encouraged to apply.",Department of Health,Charlotte Maxeke Johannesburg Academic Hospital,18-01-2024,"['Do you have an appropriate qualifications that allow registration with HPCSA as Medical Practitioner?', 'Do you have a registration with  the  HPCSA  as a Medical Practitioner']","Due to the large number of applications we envisage receiving, applications will not be acknowledged. If you 
                                                    do not receive any response within 3 months, please accept that your application was not successful."
